{
  "$schema": "http://json-schema.org/draft-07/schema#",
  "title": "Module",
  "type": "object",
  "required": ["main", "activation", "modificators"],
  "properties": {
    "main": {
      "type": "object",
      "required": ["name", "type", "category", "size", "position"],
      "properties": {
        "name": { "type": "string" },
        "type": { "type": "string" },
        "category": { "type": "string" },

        "class": { "type": "string" },

        "size": { "type": "number" },
        "position": {
          "type": "string",
          "enum": ["internal", "external"]
        },
        "tags": {
          "type": "array",
          "items": { "type": "string" }
        }
      }
    },

    "activation": {
      "type": "string",
      "enum": ["passive", "active", "overload"]
    },

    "initFunctions": { "type": "string" },

    "interference": { "type": "number" },

    "cycle": { "type": "number" },
    "reload": { "type": "number" },

    "launcher": { 
      "oneOf": [
        {
          "type": "object",
          "properties": {
            "heading": { "type": "number" },
            "vector": {
              "type": "array",
              "items": { "type": "number" },
              "minItems": 2,
              "maxItems": 2
            },
            "subgridRotation": { "type": "number" },
            "distanceOffset": { "type": "number" },
            "backupDistance": { "type": "number" },
            "recovery": {
              "type": "object",
              "properties": {
                "fuel": { "type": "number" },
                "temperature": { "type": "number" },
                "hp": {
                  "type": "object",
                  "properties": {
                    "hull": { "type": "number" },
                    "armor": { "type": "number" },
                    "barrier": { "type": "number" }
                  }
                }
              }
            }
          }
        },
        {
          "type": "object",
          "required": ["instances"],
          "properties": {
            "heading": { "type": "number" },
            "instances": {
              "type": "array",
              "items": {
                "type": "object",
                "required": ["vector", "headingOffset", "distanceOffset", "subgrid"],
                "properties": {
                  "vector": {
                    "type": "array",
                    "items": { "type": "number" },
                    "minItems": 2,
                    "maxItems": 2
                  },
                  "headingOffset": { "type": "number" },
                  "distanceOffset": { "type": "number" },
                  "subgridRotation": { "type": "number" },

                  "fire": {
                    "type": "object",
                    "required": ["type", "delay"],
                    "properties": {
                      "type": { "type": "string" },
                      "delay": {
                        "oneOf": [
                          { "type": "number" },
                          {
                            "type": "array",
                            "items": { "type": "number" }
                          }
                        ]
                      }
                    }
                  },

                  "subgrid": {
                    "type": "object",
                    "required": ["class", "dataRef"],
                    "properties": {
                      "class": { "type": "string" },
                      "dataRef": { "type": "string" }
                    }
                  }
                }
              }
            }
          }
        }
      ]
    },

    "additionalInfo": {
      "type": "object"
    },

    "effects": {
      "type": "array",
      "items": {
        "type": "object",
        "required": ["class", "isWeapon", "activateOn"],
        "properties": {
          "class": { "type": "string", "minLength": 1 },
          "activateOn": { 
            "type": "array",
            "items": {
              "type": "string",
              "enum": ["passive", "active", "overload"]
            }
          },
          "settings": {
            "type": "object"
          }
        }
      }
    },

    "modificators": {
      "type": "object",
      "required": ["offline", "online", "active", "overload"],
      "properties": {
        "offline": {
          "type": "array",
          "items": { "$ref": "#/definitions/modRecord" }
        },
        "online": {
          "type": "array",
          "items": { "$ref": "#/definitions/modRecord" }
        },
        "active": {
          "type": "array",
          "items": { "$ref": "#/definitions/modRecord" }
        },
        "overload": {
          "type": "array",
          "items": { "$ref": "#/definitions/modRecord" }
        }
      }
    },

    "external": {
      "type": "object",
      "patternProperties": {
        "^.*$": { 
          "type": "string",
          "pattern": "^([\\w-_]+(\\/|.json))+$"
        }
      }
    }
  },

  "definitions": {
    "modRecord": {
      "type": "object",
      "required": ["target", "characteristic", "modificationType", "modificator"],
      "properties": {
        "target": {
          "type": "string",
          "enum": ["this", "target", "area", "subgrid"]
        },
        "affectedLayers": {
          "type": "array",
          "items": {
            "type": "string",
            "enum": ["battleship", "missile", "drone", "shell", "mine"]
          }
        },
        "characteristic": { "type": "string" },

        "modificationType": {
          "type": "string",
          "enum": ["number", "percent"]
        },

        "modificator": {
          "oneOf": [
            { "type": "number" },
            { "type": "string" }
          ]
        },

        "isAffectedByInterference": { "type": "boolean" }
      }
    }
  }
}
