{
  "main": {
    "name": "Проф. Особенность типа «Богомол»",
    "type": "Проф. Особенность типа",
    "category": "Проф. Особенность Фрегата",

    "size": 0,
    "position": "internal",
    "tags": ["stp"]
  },
  "activation": "passive",
  "interference": 0,

  "modificators": {
    "offline": [],
    "online": [
        {
        "target": "this",
        "characteristic": "constant.modulemodifier.engineering.armor.active_repair_consumption",
        "modificationType": "percent",
        "modificator": 0.5,
        "isAffectedByInterference": false
      }
    ],
    "active": [],
    "overload": []
  }
}