{
  "main": {
    "name": "Внешний радиатор S",
    "type": "Термодинамика",
    "category": "Радиатор",

    "size": 1,
    "position": "internal",
    "tags": ["externalradiator","cooler"]
  },
  "activation": "active",
  "cycle": 1,
  "reload": 1,
  
  "interference": 0,

  "modificators": {
    "offline": [],
    "online": [],
    "active": [
      {
        "target": "this",
        "characteristic": "constant.capacitor.generation",
        "modificationType": "number",
        "modificator": -2,
        "isAffectedByInterference": false
      },
      {
        "target": "this",
        "characteristic": "constant.body.signature",
        "modificationType": "percent",
        "modificator": 0.08,
        "isAffectedByInterference": false
      },
      {
        "target": "this",
        "characteristic": "constant.heating",
        "modificationType": "number",
        "modificator": -0.04,
        "isAffectedByInterference": true
      }
    ],
    "overload": []
  }
}