{
  "main": {
    "name": "Интерферентная ячейка щита",
    "type": "Сопротивляемость",
    "category": "Расширитель Щита",

    "size": 2,
    "position": "internal",
    "tags": ["shieldextender", "signaturepenalty"]
  },
  "activation": "passive",
  "interference": -0.09,

  "modificators": {
    "offline": [],
    "online": [
      {
        "target": "this",
        "characteristic": "constant.body.signature",
        "modificationType": "percent",
        "modificator": 1.1,
        "isAffectedByInterference": false
      },
      {
        "target": "this",
        "characteristic": "constant.hp.barrier",
        "modificationType": "percent",
        "modificator": 1.3,
        "isAffectedByInterference": true
      }
    ],
    "active": [],
    "overload": []
  }
}