{
  "main": {
    "name": "Микродисторционный привод S",
    "type": "Мобильность",
    "category": "Микродисторционный привод",

    "size": 1,
    "position": "internal",
    "tags": ["microdistortiondrive", "signaturepenalty"]
  },
  "activation": "active",
  "cycle": 1,
  "reload": 0,
  
  "interference": -1,

  "modificators": {
    "offline": [],
    "online": [],
    "active": [
        {
        "target": "this",
        "characteristic": "constant.capacitor.generation",
        "modificationType": "number",
        "modificator": -10,
        "isAffectedByInterference": false
      },
      {
        "target": "this",
        "characteristic": "constant.acceleration",
        "modificationType": "percent",
        "modificator": 1.5,
        "isAffectedByInterference": true
      },
      {
        "target": "this",
        "characteristic": "constant.heating",
        "modificationType": "number",
        "modificator": 0.03,
        "isAffectedByInterference": false
      },
      {
        "target": "this",
        "characteristic": "constant.body.signature",
        "modificationType": "percent",
        "modificator": 2.5,
        "isAffectedByInterference": false
      }
    ],
    "overload": []
  }
}