{
  "main": {
    "name": "Активная универсальная обшивка",
    "type": "Сопротивляемость",
    "category": "Реактивная мембрана брони",

    "size": 2,
    "position": "internal",
    "tags": ["armorresistanceextender", "omniresistextender"]
  },
  "activation": "active",
  "cycle": 1,
  "reload": 0,
  
  "interference": -0.0625,

  "additionalInfo": {
    "effectiveness": 0.25,
    "baseHeating": 0.04,
    "baseConsumption": -3
  },

  "modificators": {
    "offline": [],
    "online": [],
    "active": [
        {
        "target": "this",
        "characteristic": "constant.capacitor.generation",
        "modificationType": "number",
        "modificator": "module.characteristics.additionalInfo.baseConsumption * parent.currentCharacteristics.constant.modulemodifier.engineering.hardener.active.armor.capacitor_consumption_modifier",
        "isAffectedByInterference": false
      },
      {
        "target": "this",
        "characteristic": "constant.heating",
        "modificationType": "number",
        "modificator": "module.characteristics.additionalInfo.baseHeating * parent.currentCharacteristics.constant.modulemodifier.engineering.hardener.active.armor.heating_modifier",
        "isAffectedByInterference": false
      },
      {
        "target": "this",
        "characteristic": "constant.resistance.kinetic.armor",
        "modificationType": "number",
        "modificator": "module.characteristics.additionalInfo.effectiveness * parent.currentCharacteristics.constant.modulemodifier.engineering.hardener.active.armor.effectiveness_modifier",
        "isAffectedByInterference": true
      },
      {
        "target": "this",
        "characteristic": "constant.resistance.high_explosive.armor",
        "modificationType": "number",
        "modificator": "module.characteristics.additionalInfo.effectiveness * parent.currentCharacteristics.constant.modulemodifier.engineering.hardener.active.armor.effectiveness_modifier",
        "isAffectedByInterference": true
      },
      {
        "target": "this",
        "characteristic": "constant.resistance.electro_magnetic.armor",
        "modificationType": "number",
        "modificator": "module.characteristics.additionalInfo.effectiveness * parent.currentCharacteristics.constant.modulemodifier.engineering.hardener.active.armor.effectiveness_modifier",
        "isAffectedByInterference": true
      },
      {
        "target": "this",
        "characteristic": "constant.resistance.thermal.armor",
        "modificationType": "number",
        "modificator": "module.characteristics.additionalInfo.effectiveness * parent.currentCharacteristics.constant.modulemodifier.engineering.hardener.active.armor.effectiveness_modifier",
        "isAffectedByInterference": true
      }
    ],
    "overload": []
  }
}