{
  "main": {
    "name": "Форсажная камера S",
    "type": "Мобильность",
    "category": "Форсажная камера",

    "size": 1,
    "position": "internal",
    "tags": ["afterburner", "maneuverbuff"]
  },
  "activation": "active",
  "cycle": 1,
  "reload": 1,
  
  "interference": -1,

  "modificators": {
    "offline": [],
    "online": [],
    "active": [
      {
        "target": "this",
        "characteristic": "constant.capacitor.generation",
        "modificationType": "number",
        "modificator": -5,
        "isAffectedByInterference": false
      },
      {
        "target": "this",
        "characteristic": "constant.acceleration",
        "modificationType": "percent",
        "modificator": 0.4,
        "isAffectedByInterference": true
      },
      {
        "target": "this",
        "characteristic": "constant.heating",
        "modificationType": "number",
        "modificator": 0.03,
        "isAffectedByInterference": false
      }
    ],
    "overload": []
  }
}