{
  "main": {
    "name": "RES Vampire",
    "type": "РЭБ",
    "category": "Система нейтрализации накопителя",

    "size": 2,
    "position": "internal",
    "tags": ["capacitorew", "ew"]
  },
  "activation": "active",
  "interference": 0,

  "additionalInfo": {
    "recharge": 1
  },

  "modificators": {
    "offline": [],
    "online": [],
    "active": [
      {
        "target": "this",
        "characteristic": "constant.capacitor.generation",
        "modificationType": "number",
        "modificator": 5,
        "isAffectedByInterference": false
      },
      {
        "target": "target",
        "characteristic": "constant.capacitor.generation",
        "modificationType": "number",
        "modificator": -5,
        "isAffectedByInterference": false
      }
    ],
    "overload": []
  }
}