{
  "main": {
    "name": "Проф. Особенность типа «Мотылёк»",
    "type": "Проф. Особенность типа",
    "category": "Проф. Особенность Эсминца",

    "size": 0,
    "position": "internal",
    "tags": ["stp"]
  },
  "activation": "passive",
  "interference": 0,

  "modificators": {
    "offline": [],
    "online": [
      {
        "target": "this",
        "characteristic": "constant.body.subgrid.fuel",
        "modificationType": "percent",
        "modificator": 0.75,
        "isAffectedByInterference": false
      },
      {
        "target": "this",
        "characteristic": "constant.body.subgrid.acceleration",
        "modificationType": "percent",
        "modificator": 1.5,
        "isAffectedByInterference": true
      },
      {
        "target": "this",
        "characteristic": "constant.body.subgrid.explosion.effect.damage.high_explosive",
        "modificationType": "percent",
        "modificator": 1.15,
        "isAffectedByInterference": true
      },
      {
        "target": "this",
        "characteristic": "constant.modulemodifier.engineering.barrier.resonance.tendency",
        "modificationType": "number",
        "modificator": 0.15,
        "isAffectedByInterference": true
      }
    ],
    "active": [],
    "overload": []
  }
}

