{
  "main": {
    "name": "Модуль откачки барьера M",
    "type": "Восстановление",
    "category": "Система откачки барьера",

    "size": 2,
    "position": "internal",
    "tags": ["shieldrecharger"]
  },
  "activation": "active",
  "interference": 0,

  "reload": 0,
  "cycle": 1,

  "additionalInfo": {
    "baseRecharge": 80,
    "baseHeating": 0.07,
    "baseConsumption": -15
  },

  "modificators": {
    "offline": [],
    "online": [],
    "active": [
      {
        "target": "this",
        "characteristic": "constant.capacitor.generation",
        "modificationType": "number",
        "modificator": "module.characteristics.additionalInfo.baseConsumption * parent.currentCharacteristics.constant.modulemodifier.engineering.barrier.active_recharge_consumption",
        "isAffectedByInterference": false
      },
      {
        "target": "this",
        "characteristic": "constant.heating",
        "modificationType": "number",
        "modificator": "module.characteristics.additionalInfo.baseHeating * parent.currentCharacteristics.constant.modulemodifier.engineering.barrier.active_recharge_heating",
        "isAffectedByInterference": false
      },
      {
        "target": "this",
        "characteristic": "dynamic.hp.barrier",
        "modificationType": "number",
        "modificator": "module.characteristics.additionalInfo.baseRecharge * parent.currentCharacteristics.constant.modulemodifier.engineering.barrier.active_recharge_modifier",
        "isAffectedByInterference": false
      }
    ],
    "overload": []
  }
}